{
  "$schema": "./schema/facts-file.schema.json",
  "$comment": "Fact registry: the canonical vocabulary of applicability variables a rule's appliesWhen may test and a scenario or business profile may supply. Facts are observable inputs, not derived values (derived recipes live in server/scheduler/derivedFacts.ts). Enums over free text for bounded domains; one namespace per entity; scoped employee counts are separate facts. 'synonyms' are the terms people use for the same thing; resolveFact() in server/rules/facts.ts accepts a path or a synonym.",
  "version": "2026-10-30",
  "categories": [
    {
      "id": "1. Location",
      "name": "Location"
    },
    {
      "id": "2. Employer",
      "name": "Employer"
    },
    {
      "id": "3. Employee",
      "name": "Employee"
    },
    {
      "id": "4. Shift",
      "name": "Shift"
    },
    {
      "id": "5. Schedule",
      "name": "Schedule"
    },
    {
      "id": "6. Leave",
      "name": "Leave"
    },
    {
      "id": "7. Termination",
      "name": "Termination"
    },
    {
      "id": "8. Payroll",
      "name": "Payroll"
    }
  ],
  "facts": [
    {
      "path": "location.country",
      "type": "string",
      "description": "ISO country code (e.g. US, PR, GU)",
      "category": "1. Location",
      "group": "1.1 Work Location"
    },
    {
      "path": "location.state",
      "type": "string",
      "description": "Two-letter state code (e.g. CA, NY)",
      "category": "1. Location",
      "group": "1.1 Work Location",
      "synonyms": [
        "state",
        "work state",
        "state code"
      ]
    },
    {
      "path": "location.city",
      "type": "string",
      "description": "City name",
      "category": "1. Location",
      "group": "1.1 Work Location",
      "synonyms": [
        "city",
        "municipality",
        "work city"
      ]
    },
    {
      "path": "location.county",
      "type": "string",
      "description": "County name",
      "category": "1. Location",
      "group": "1.1 Work Location",
      "synonyms": [
        "county"
      ]
    },
    {
      "path": "location.is_unincorporated",
      "type": "boolean",
      "description": "Whether work location is in an unincorporated area",
      "category": "1. Location",
      "group": "1.1 Work Location",
      "synonyms": [
        "unincorporated area",
        "outside city limits"
      ]
    },
    {
      "path": "location.tribal_land",
      "type": "boolean",
      "description": "Whether work location is on tribal land",
      "category": "1. Location",
      "group": "1.1 Work Location"
    },
    {
      "path": "location.primary_work_state",
      "type": "string",
      "description": "Primary work state for multi-state employees",
      "category": "1. Location",
      "group": "1.2 Primary Work Location (for multi-jurisdiction employees)"
    },
    {
      "path": "location.primary_work_city",
      "type": "string",
      "description": "Primary work city",
      "category": "1. Location",
      "group": "1.2 Primary Work Location (for multi-jurisdiction employees)"
    },
    {
      "path": "location.primary_work_county",
      "type": "string",
      "description": "Primary work county",
      "category": "1. Location",
      "group": "1.2 Primary Work Location (for multi-jurisdiction employees)"
    },
    {
      "path": "location.employee_residence_state",
      "type": "string",
      "description": "Employee residence state (for leave laws)",
      "category": "1. Location",
      "group": "1.2 Primary Work Location (for multi-jurisdiction employees)"
    },
    {
      "path": "location.employee_residence_city",
      "type": "string",
      "description": "Employee residence city",
      "category": "1. Location",
      "group": "1.2 Primary Work Location (for multi-jurisdiction employees)"
    },
    {
      "path": "location.multi_state_employer",
      "type": "boolean",
      "description": "Whether employer operates in multiple states",
      "category": "1. Location",
      "group": "1.3 Multi-Jurisdiction"
    },
    {
      "path": "location.multi_jurisdiction_employee",
      "type": "boolean",
      "description": "Whether employee works across multiple jurisdictions",
      "category": "1. Location",
      "group": "1.3 Multi-Jurisdiction"
    },
    {
      "path": "employer.total_employees",
      "type": "number",
      "description": "Total number of employees (unscoped / as specified by rule)",
      "category": "2. Employer",
      "group": "2.1 Size",
      "synonyms": [
        "headcount",
        "employee count",
        "number of employees",
        "company size"
      ]
    },
    {
      "path": "employer.total_employees_global",
      "type": "number",
      "description": "Total employees worldwide (all locations)",
      "category": "2. Employer",
      "group": "2.1 Size",
      "synonyms": [
        "employees worldwide",
        "global headcount",
        "total employees nationwide"
      ]
    },
    {
      "path": "employer.total_employees_us",
      "type": "number",
      "description": "Total employees in the United States",
      "category": "2. Employer",
      "group": "2.1 Size",
      "synonyms": [
        "US employees",
        "domestic headcount"
      ]
    },
    {
      "path": "employer.total_employees_state",
      "type": "number",
      "description": "Total employees in the state",
      "category": "2. Employer",
      "group": "2.1 Size",
      "synonyms": [
        "employees in the state",
        "in-state headcount"
      ]
    },
    {
      "path": "employer.total_employees_city",
      "type": "number",
      "description": "Total employees in the city",
      "category": "2. Employer",
      "group": "2.1 Size",
      "synonyms": [
        "employees in the city",
        "local headcount"
      ]
    },
    {
      "path": "employer.total_employees_at_location",
      "type": "number",
      "description": "Total employees at the specific work location",
      "category": "2. Employer",
      "group": "2.1 Size",
      "synonyms": [
        "employees at the site",
        "store headcount",
        "location headcount"
      ]
    },
    {
      "path": "employer.number_of_locations",
      "type": "number",
      "description": "Number of business locations",
      "category": "2. Employer",
      "group": "2.1 Size"
    },
    {
      "path": "employer.annual_gross_revenue",
      "type": "money",
      "description": "Annual gross revenue in dollars",
      "category": "2. Employer",
      "group": "2.2 Revenue"
    },
    {
      "path": "employer.annual_gross_sales",
      "type": "money",
      "description": "Annual gross sales in dollars (FLSA enterprise coverage)",
      "category": "2. Employer",
      "group": "2.2 Revenue"
    },
    {
      "path": "employer.is_franchisee",
      "type": "boolean",
      "description": "Whether employer is a franchisee",
      "category": "2. Employer",
      "group": "2.3 Structure"
    },
    {
      "path": "employer.is_franchisor",
      "type": "boolean",
      "description": "Whether employer is a franchisor",
      "category": "2. Employer",
      "group": "2.3 Structure"
    },
    {
      "path": "employer.is_chain",
      "type": "boolean",
      "description": "Whether employer is part of a chain (typically 30+ locations)",
      "category": "2. Employer",
      "group": "2.3 Structure"
    },
    {
      "path": "employer.is_joint_employer",
      "type": "boolean",
      "description": "Whether employer is a joint employer (aggregates employee counts)",
      "category": "2. Employer",
      "group": "2.3 Structure"
    },
    {
      "path": "employer.is_staffing_agency",
      "type": "boolean",
      "description": "Whether employer is a staffing/temp agency",
      "category": "2. Employer",
      "group": "2.3 Structure"
    },
    {
      "path": "employer.is_government_entity",
      "type": "boolean",
      "description": "Whether employer is a government entity",
      "category": "2. Employer",
      "group": "2.4 Government & Union"
    },
    {
      "path": "employer.is_nonprofit",
      "type": "boolean",
      "description": "Whether employer is a nonprofit organization",
      "category": "2. Employer",
      "group": "2.4 Government & Union"
    },
    {
      "path": "employer.is_federal_contractor",
      "type": "boolean",
      "description": "Whether employer is a federal contractor",
      "category": "2. Employer",
      "group": "2.4 Government & Union"
    },
    {
      "path": "employer.is_state_contractor",
      "type": "boolean",
      "description": "Whether employer is a state contractor",
      "category": "2. Employer",
      "group": "2.4 Government & Union"
    },
    {
      "path": "employer.is_prevailing_wage_project",
      "type": "boolean",
      "description": "Whether work is on a prevailing wage project (Davis-Bacon)",
      "category": "2. Employer",
      "group": "2.4 Government & Union"
    },
    {
      "path": "employer.has_collective_bargaining_agreement",
      "type": "boolean",
      "description": "Whether a CBA covers the workforce or relevant employees",
      "category": "2. Employer",
      "group": "2.4 Government & Union"
    },
    {
      "path": "employer.is_unionized_workforce",
      "type": "boolean",
      "description": "Whether the workforce is unionized",
      "category": "2. Employer",
      "group": "2.4 Government & Union"
    },
    {
      "path": "employer.industry_tag",
      "type": "enum",
      "description": "Primary industry classification",
      "category": "2. Employer",
      "group": "2.5 Industry (merged from Business namespace)",
      "enumValues": [
        "retail",
        "fast_food",
        "restaurant",
        "hospitality",
        "hotel",
        "healthcare",
        "manufacturing",
        "construction",
        "agriculture",
        "transportation",
        "warehouse",